{
  "firm": {
    "corporate_name": "Souza Guedes Advogados",
    "trade_name": "Souza Guedes Advogados",
    "oab_registration": "511.204/SP e 538.416/SP",
    "foundation_year": 2026,
    "mission": "Cuidar dos interesses de nossos clientes, antecipar riscos e encontrar soluções jurídicas que façam sentido para cada situação. Aliamos conhecimento, estratégia e uma advocacia próxima e acessível, buscando oferecer segurança e tranquilidade em cada decisão.",
    "vision": "Nossa visão é crescer e nos consolidar no mercado jurídico, construindo um escritório reconhecido pela qualidade do nosso trabalho, pela confiança que transmitimos e pela forma atual e próxima de fazer advocacia.",
    "values": [
      "SOLIDEZ: Construímos nossa atuação sobre bases firmes, com segurança, estabilidade e responsabilidade.",
      "CREDIBILIDADE: Fazemos da confiança uma consequência natural da seriedade e da transparência com que conduzimos nosso trabalho.",
      "EXCELÊNCIA: Não tratamos qualidade como diferencial, mas como padrão em cada trabalho que entregamos."
    ],
    "address": {
      "street": "Rua Uhland",
      "number": "784",
      "complement": "Casa 1",
      "neighborhood": "Vila Ema",
      "city": "São Paulo",
      "state": "SP",
      "postal_code": "03283-000"
    },
    "history": [
      "A Souza Guedes Advogados foi fundada em 2026 pelos advogados Lays Regina de Souza e Rodrigo Guedes da Silva, com sede na Vila Ema, Zona Leste de São Paulo.",
      "O escritório atua no Direito Civil, em quatro áreas: Direito Imobiliário, Direito de Saúde, Direito do Consumidor e Direito de Família e Sucessões. O trabalho tem duas frentes. Na consultiva, o escritório orienta antes que o problema se instale: analisa documentos, contratos, matrículas e editais e aponta os riscos de cada decisão. Na contenciosa, conduz as medidas extrajudiciais e judiciais necessárias quando o conflito já existe.",
      "Cada caso é analisado e acompanhado diretamente pelos sócios. O atendimento é presencial na sede, com agendamento, ou pelos canais oficiais do escritório.",
      "A atuação se apoia em três valores, solidez, credibilidade e excelência, e segue o Estatuto da Advocacia, o Código de Ética e Disciplina da OAB e o Provimento CFOAB nº 205/2021: informação clara, sem promessa de resultado e sem captação de clientela."
    ],
    "pending": [
      "Fatos da fundação que os sócios queiram registrar (motivação, escolha da Vila Ema).",
      "Confirmar que todos os casos são conduzidos diretamente pelos sócios, como diz o terceiro parágrafo."
    ]
  },
  "partners": [
    {
      "name": "Rodrigo Guedes da Silva",
      "oab_number": "OAB/SP nº 538.416",
      "role": "Advogado",
      "primary_area": "Direito Civil",
      "bio": "Advogado, graduado pela Universidade São Judas Tadeu (USJT), com qualificação adicional através do curso de extensão em Falências e Recuperações Judiciais da Escola Superior de Advocacia da Ordem dos Advogados do Brasil (ESA/OAB).",
      "bio_long": [
        "Rodrigo Guedes da Silva é advogado inscrito na OAB/SP sob o nº 538.416 e sócio fundador da Souza Guedes Advogados. Graduou-se em Direito pela Universidade São Judas Tadeu (USJT) e concluiu o curso de extensão em Falências e Recuperações Judiciais da Escola Superior de Advocacia da OAB (ESA/OAB).",
        "Atua no Direito Civil, nas áreas de atuação do escritório."
      ],
      "education": [
        {
          "level": "Graduação",
          "course": "Direito",
          "institution": "Universidade São Judas Tadeu (USJT)"
        },
        {
          "level": "Extensão",
          "course": "Falências e Recuperações Judiciais",
          "institution": "Escola Superior de Advocacia da OAB (ESA/OAB)"
        }
      ],
      "publications": [],
      "pending": [
        "Ano de conclusão da graduação, da extensão e de inscrição na OAB/SP.",
        "Publicações, se houver.",
        "Experiência profissional anterior à fundação do escritório, se for para constar.",
        "Áreas do escritório em que atua com mais frequência, se for para constar."
      ]
    },
    {
      "name": "Lays Regina de Souza",
      "oab_number": "OAB/SP nº 511.204",
      "role": "Advogada",
      "primary_area": "Direito Civil",
      "bio": "Advogada, graduada pela Universidade São Judas Tadeu (USJT), pós-graduada em Direito Imobiliário Notarial e Registral pela Pontifícia Universidade Católica (PUC).",
      "bio_long": [
        "Lays Regina de Souza é advogada inscrita na OAB/SP sob o nº 511.204 e sócia fundadora da Souza Guedes Advogados. Graduou-se em Direito pela Universidade São Judas Tadeu (USJT) e é pós-graduada em Direito Imobiliário Notarial e Registral pela Pontifícia Universidade Católica (PUC).",
        "Atua no Direito Civil, nas áreas de atuação do escritório. A formação em direito notarial e registral apoia o trabalho com matrículas, escrituras e procedimentos em cartório, como a usucapião extrajudicial e o inventário por escritura pública."
      ],
      "education": [
        {
          "level": "Graduação",
          "course": "Direito",
          "institution": "Universidade São Judas Tadeu (USJT)"
        },
        {
          "level": "Pós-graduação",
          "course": "Direito Imobiliário Notarial e Registral",
          "institution": "Pontifícia Universidade Católica (PUC)"
        }
      ],
      "publications": [],
      "pending": [
        "Unidade da PUC e ano de conclusão da pós-graduação.",
        "Ano de conclusão da graduação e de inscrição na OAB/SP.",
        "Publicações, se houver.",
        "Experiência profissional anterior à fundação do escritório, se for para constar.",
        "Confirmar a relação entre a pós-graduação e o trabalho em cartório descrita no segundo parágrafo."
      ]
    }
  ],
  "practice_areas": [
    {
      "id": "real-estate-law",
      "slug": "direito-imobiliario",
      "title": "Direito Imobiliário",
      "focus": "Usucapião extrajudicial e judicial, despejo, reintegração de posse, assessoria para arrematação, imissão na posse, indenizatória para atraso na entrega do imóvel e demais demandas relacionadas à aquisição, posse, propriedade e utilização de imóveis.",
      "summary": "Atuação em usucapião, despejo, reintegração e imissão na posse, assessoria para arrematação e indenização por atraso na entrega de imóveis.",
      "scope_items": [
        "Atuação em processos de usucapião judicial e extrajudicial, desde a análise documental e verificação dos requisitos até o acompanhamento do procedimento perante o Poder Judiciário ou Cartório de Registro de Imóveis",
        "Atuação em ações de despejo, reintegração de posse e imissão na posse, envolvendo conflitos relacionados à ocupação, locação e retomada de imóveis",
        "Assessoria jurídica em arrematação de imóveis, com análise do edital, matrícula, ônus e riscos jurídicos da aquisição, além do acompanhamento das medidas necessárias à consolidação da posse e propriedade",
        "Propositura de ações indenizatórias decorrentes de atraso na entrega de imóveis, incluindo análise dos prejuízos suportados pelo adquirente e das obrigações assumidas pela incorporadora ou construtora"
      ],
      "target_audience": [
        "Pessoas físicas proprietárias, possuidoras, adquirentes ou locatárias de imóveis",
        "Investidores e arrematantes",
        "Construtoras, incorporadoras, imobiliárias e empresas que possuem ou utilizam imóveis em suas atividades"
      ],
      "description": [
        "A área de Direito Imobiliário reúne as questões jurídicas ligadas à aquisição, à posse, à propriedade e ao uso de imóveis. O escritório atua em usucapião judicial e extrajudicial, em ações de despejo, reintegração e imissão na posse, na assessoria para arrematação de imóveis em leilão e em ações indenizatórias por atraso na entrega de imóveis.",
        "O trabalho começa pela análise documental: matrícula, contratos, edital do leilão e comprovantes de posse. É essa análise que indica se o caminho é extrajudicial, como a usucapião perante o Cartório de Registro de Imóveis ou a notificação para desocupação, ou se a questão precisa ser levada ao Judiciário.",
        "A área atende pessoas físicas proprietárias, possuidoras, adquirentes ou locatárias de imóveis, investidores e arrematantes, e também construtoras, incorporadoras, imobiliárias e empresas que possuem ou utilizam imóveis em suas atividades."
      ]
    },
    {
      "id": "health-law",
      "slug": "direito-de-saude",
      "title": "Direito de Saúde",
      "focus": "Liberação de medicamentos e tratamentos, negativas de cobertura, recusa de internação, manutenção e restabelecimento de convênio médico, reajustes abusivos, cobertura de procedimentos e cirurgias, responsabilidade civil por erro médico e demais demandas relacionadas à proteção do direito à saúde.",
      "summary": "Atuação em negativas de cobertura, liberação de medicamentos e tratamentos, manutenção de convênio, reajustes e responsabilidade civil por erro médico.",
      "scope_items": [
        "Atuação em demandas para obtenção de medicamentos, tratamentos, procedimentos e cirurgias negados por planos de saúde, inclusive mediante pedido de tutela de urgência",
        "Ações para manutenção, restabelecimento ou cobertura de plano de saúde, diante de negativa indevida, cancelamento ou recusa de atendimento",
        "Atuação em casos de negativa de internação, exames, terapias e procedimentos médicos, com adoção das medidas judiciais necessárias à garantia do tratamento indicado",
        "Ações envolvendo reajustes abusivos e cobranças indevidas por parte de operadoras de planos de saúde",
        "Atuação em demandas de responsabilidade civil decorrentes de erro médico e falhas na prestação de serviços de saúde, incluindo análise da conduta profissional e dos danos suportados pelo paciente"
      ],
      "target_audience": [